Title,Authors,Keywords,Journal,Abstract
The unconscious perception of smells as a driver of consumer responses: a framework integrating the emotion-cognition approach to scent marketing,"De Luca, Ramona ;  Botelho, Delane",Business and Management ;  Cognition & reasoning ;  Consumers ;  Marketing ;  Odors ;  Social Sciences ;  Theory/Conceptual,"AMS review, 2021, Vol.11 (1-2), p.145-161","Previous research demonstrates that odors affect consumers’ behavioral, cognitive, and affective responses to products and environments. Sensory and scent research have prioritized an emotional approach in which consumer responses are primarily affective reactions to smells. However, individuals’ perceptions of their environment are frequently regulated by an unconscious mechanism that does not necessarily involve rational thinking. Therefore, their responses to odors may result from automatic and unconscious cognitive processes that occur without their awareness. We propose that the unconscious odor interpretation better regulates consumers’ responses to odors and behaviors than emotions and that the way in which olfactory information is cognitively processed and integrated into knowledge may address the extent to which odors help individuals to perceive their environment holistically and attribute meanings to events and social phenomena. Through a systematic review of 55 empirical studies on olfaction, we i) discuss the current theoretical approaches to scent marketing and the most relevant empirical findings; ii) propose a cognition-based framework to investigate the underlying mechanisms through which odors are mentally processed to influence consumers’ behavioral, cognitive, and affective responses; and iii) develop a research agenda to encourage further studies on the cognitive processing of scents."
On managerial relevance: reconciling the academic-practitioner divide through market theorizing,"Wieland, Heiko ;  Nariswari, Angeline ;  Akaka, Melissa Archpru",Business and Management ;  Marketing ;  Social Sciences ;  Theory/Conceptual,"AMS review, 2021, Vol.11 (3-4), p.252-271","The marketing academy continues to struggle with issues of managerial relevance. We argue that, at its core, marketing’s problems with managerial relevance do not lie in diverging roles and interests between academics and practitioners, but in the distinct lenses market actors apply to view and enact market realities. Building on market performativity, we assert that concepts and theories not only depict the world ‘out there,’ but also contribute to bringing about reality when enacted. Thus, the relevance of marketing academics and their work cannot simply be addressed by changing how research is conducted (e.g., more industry engagement), but more foundationally, through a shift in what is researched and how phenomena are studied. By refocusing the discussion from managerial relevance to the relevance of theoretical work in the shaping of markets, we show that both academics and practitioners need to be more cognizant of the market conceptualizations they help to perpetuate. All market actors need to broaden their understanding of markets to incorporate stable as well as dynamic and systemic depictions of markets. Market actors, paradoxically, need to become more theoretical to be more relevant in the shaping of markets."
The instantaneous commitment effect: developing stakeholder orientation among managers,"Vaid, Shashank ;  Ahearne, Michael",Business and Management ;  Marketing ;  Social Sciences ;  Theory/Conceptual,"AMS review, 2021, Vol.11 (1-2), p.162-179","The authors introduce and investigate incoming managers’ instantaneous commitment - a novel concept increasingly relevant to frontline managers. Instantaneous commitment is a type of organizational commitment that can be formed expediently on the back of incoming managers’ preexisting role/work-related factors (stakeholder connections, relationships, and skills) offering organizations guidance on managers’ stakeholder orientation. Moreover, instantaneous commitment helps organizations avoid the classic loyalty-utility dilemma, as it provides an organization-wide instantaneous approach towards better stakeholder focus while being agnostic to emotional investment (loyalty) and to calculative assessment (utility) that may take shape over time. The authors provide a parsimonious explanation of instantaneous commitment construct and differentiate it from related constructs (affective commitment and continuance commitment). We also offer an understanding of how organizations can engender instantaneous commitment among managers. Finally, we develop a conceptual framework of a set of factors - prior role/work related antecedents, stakeholder orientation consequence of instantaneous commitment, and moderating influences of individual, environmental and new role/work related factors."
"Addressing socio-ecological issues in marketing: environmental, social and governance (ESG)","Ferrell, O. C.",Business and Management ;  Commentary ;  Marketing ;  Social Sciences,"AMS review, 2021, Vol.11 (1-2), p.140-144","This commentary addresses the Social and Ecological Thought (SET) framework based on virtue ethics (Dyck & Manchanda, in 
AMS Review
,
2021
). The basis of this framework is to replace utilitarian values that focus on profit maximization. The Financial Bottom Line (FBL) is believed to be a mainstream utilitarian philosophy. In addition, the Triple Bottom Line (TBL) is considered inadequate to address socio-ecological issues because there is a major focus on financial performance. After addressing some of the limitations in the SET framework, the Environmental, Social and Governance (ESG) framework is presented as a more relevant alternative. ESG provides a lens for creating priorities for socio-ecological comparative performance based on industry, investors’ and peer index scores. There is a strong correlation between ESG performance and profits. Compelling evidence is provided that suggests there is no conflict between socio-ecological responsibility and financial success."
Markets and institutional fields: foundational concepts and a research agenda,"Mountford, Nicola ;  Geiger, Susi",Business and Management ;  Marketing ;  Social Sciences ;  Theory/Conceptual,"AMS review, 2021, Vol.11 (3-4), p.290-303","We borrow the notion of field from institutional theory to think through how markets and their ‘outsides’–or at least one particular manifestation of an ‘outside’–stand in a dynamic and interactive relationship. We distinguish the field and the market in terms of issues versus exchange and identity versus position. We argue that the lack of clarity as to how fields and markets differ, relate, overlap, and are bounded, jeopardizes our ability to address important societal debates concerning the roles of markets within and across other areas of social life. It also hinders a consolidation of insights across different approaches to studying markets, even though researchers from different disciplines often address similar concerns. Key questions for which both conceptual and analytical clarity are essential include how markets and their ‘outsides’ (here: fields) intersect; whether and how diverse sets of actors interact, work, and migrate between fields and markets; and what dynamics may be observable between field and market. We provide four illustrative examples of field/market relationships and a theoretical, methodological, and empirical research agenda for future research into markets and their ‘outsides’."
Correction to: Sustainable marketing based on virtue ethics: addressing socio-ecological challenges facing humankind,"Dyck, Bruno ;  Manchanda, Rajesh V.",Business and Management ;  Correction ;  Marketing ;  Social Sciences,"AMS review, 2021, Vol.11 (1-2), p.133-133",The Acknowledgement section was unfortunately missing in the original version of this article.
"Netflix: reinvention across multiple time periods, reflections and directions for future research","Mier, Joel ;  Kohli, Ajay K.",Business and Management ;  Commentary ;  Marketing ;  Social Sciences,"AMS review, 2021, Vol.11 (1-2), p.194-205",
"Markets, infrastructures and infrastructuring markets","Araujo, Luis ;  Mason, Katy",Business and Management ;  Infrastructure ;  Knowledge ;  Marketing ;  Social Sciences ;  Theory/Conceptual,"AMS review, 2021, Vol.11 (3-4), p.240-251","Despite a growing understanding of market infrastructures—the rules and socio-material arrangements that enable agreements on the properties of goods, and the calculation of value, equivalence and exchange—we know little of what lies beneath the arrangements that underpin and are implicated in exchange. The socio-material lens has done much to explain how specific assemblages circulate information and goods, but has done little to explain how different infrastructures configure relations between dispersed market practices. Using the history of
the development of the market for market research
we show how
knowledge-based infrastructures
constitute markets as knowledge objects: new expertise emerged through alliances between academia, government, and private actors form a new occupation embodied in specialist agencies that set themselves up in an infrastructural relation to marketing practices. Our conceptualization of markets as knowledge objects extends extant understandings of markets by showing how: (1) extant knowledge-based infrastructures are drawn on to construct new markets; (2) infrastructural relations emerge between different markets to constitute multiple systems of provision and demand, leading to an increasingly valuable knowledge infrastructure; and (3) organized practices in one market are often heavily reliant on connections to other markets, including knowledge-based infrastructures such as market research services."
"How valence, volume and variance of online reviews influence brand attitudes","Zablocki, Agnieszka ;  Schlegelmilch, Bodo ;  Houston, Michael J.",Attitudes ;  Brand loyalty ;  Business and Management ;  Digital marketing ;  Marketing ;  Social Sciences ;  Theory/Conceptual,"AMS review, 2019, Vol.9 (1-2), p.61-77","Online reviews can strongly influence purchase decisions. In the past decade, extensive research in the field of online reviews has focused on product categories (e.g., hedonic, utilitarian) and product sales. However, research on how the characteristics of online reviews (valence, volume, and variance) influence attitudes toward brands is sparse, even though brands are among the most valuable corporate assets and companies use online marketing extensively to increase brand loyalty. Thus, this paper offers a conceptual model that closely examines the relationship between the characteristics of online reviews and brand attitudes. The model contributes to a better understanding of the influence of contextual factors on brand attitudes within online communication. In line with prior research, the study conceptualizes volume and variance as moderators of valence. Furthermore, the proposed conceptual model integrates brand type (functional, emotional, symbolic, and lifestyle) and the source of review (stranger or acquaintance) as potential moderators. Conceptual insights, along with managerial implications for online marketing managers, are provided."
Assessing and advancing marketing’s value propositions: a disciplinary dialog,"Vargo, Stephen L.",Business and Management ;  Editorial ;  Marketing ;  Social Sciences,"AMS review, 2020, Vol.10 (3-4), p.149-150",
Reclaiming or rebranding marketing: implications beyond digital,"Ritter, Thomas",Business and Management ;  Commentary ;  Marketing ;  Social Sciences,"AMS review, 2020, Vol.10 (3-4), p.311-314",
"The changing role of marketing: transformed propositions, processes and partnerships","Storbacka, Kaj ;  Moser, Ted",Business and Management ;  Conceptual ;  Marketing ;  Social Sciences ;  Theory ;  Theory/Conceptual,"AMS review, 2020, Vol.10 (3-4), p.299-310",
First steps to creating high impact theory in marketing,"Bolton, Ruth N.",Business and Management ;  Commentary ;  Ecosystem ;  Impact ;  Marketing ;  Marketing theory ;  Research priorities ;  Responsible research ;  Social Sciences ;  Stakeholders,"AMS review, 2020, Vol.10 (3-4), p.172-178","The business research ecosystem can be transformed by responsible research principles. This commentary offers concrete guidance for developing high impact theory; it provides a tool to assess research benefits and identify participating stakeholders. It also calls for improving doctoral training, countering risk aversion in research topic selection, re-aligning faculty incentives, and leveraging academic institutions."
A framework for viral marketing replication and mutation,"Fox, Gavin L. ;  Lind, Stephen J.",Business and Management ;  Marketing ;  Social Sciences ;  Theory/Conceptual,"AMS review, 2020, Vol.10 (3-4), p.206-222","The value of successful viral marketing campaigns to marketing performance is widely acknowledged. As a result, a great deal of attention is paid to mechanisms that foster viral spread. However, due to the consumer-influenced nature of viral replication, it is also important to consider the malleability of such messages. Expanding the focus to include the potential for viral mutations is a critical step in understanding how viral messages evolve and in understanding which messages are most likely to spread and generate their desired impact. Further, there currently is no accepted model for the viral marketing replication process to guide research efforts. Therefore, this article defines viral message mutations, builds a framework for the viral replication process, and identifies susceptibility to mutation at various stages of that process. The proposed framework is then used to offer numerous avenues for future research."
"Relevance, rigor and impact of scholarly research in marketing, state of the discipline and outlook","Varadarajan, Rajan",Business and Management ;  Commentary ;  Marketing ;  Marketing theory ;  Relevance and rigor ;  Social Sciences ;  Value proposition and values proposition of the marketing academy to society,"AMS review, 2020, Vol.10 (3-4), p.199-205","This commentary presents a dissenting point of view on some of Key et al.’s (
AMS Review
,
2020
) observations concerning the relevance and rigor of scholarly research in marketing, impact of scholarly research in marketing on research in other disciplines, and influence of the marketing function in firms at the top management level."
"Marketing’s value propositions: a focus on exit, voice, and loyalty","Hult, G. Tomas M. ;  Morgeson, Forrest V.",Business and Management ;  Commentary ;  Marketing ;  Social Sciences,"AMS review, 2020, Vol.10 (3-4), p.185-188","We capture the theoretical and practical essence of the thoughts by Key, Clark, Ferrell, Stewart, and Pitt (
AMS Review
,
2020
) on marketing’s value propositions by creating an integrative satisfaction-focused exit-voice-loyalty theory. The potpourri of thoughts by Key et al. (
2020
) in this issue of
AMS Review
–centered mainly on marketing’s value propositions within the broader business academy (and practice)–lend themselves to a focus on the value propositions, dynamics, and relationships between customers and firms. With the customer-firm exchange as the lens, marketing’s value propositions are effectively brought out via the development of the satisfaction-focused exit-voice-loyalty theory (SEVL theory)
."
Brand-self connections and brand prominence as drivers of employee brand attachment,"Gill-Simmen, Lucy ;  MacInnis, Deborah J. ;  Eisingerich, Andreas B. ;  Whan Park, C.",Brand loyalty ;  Business and Management ;  Employees ;  Marketing ;  Social Sciences ;  Theory/Conceptual,"AMS review, 2018, Vol.8 (3-4), p.128-146","Past research reveals that customers can attach meanings to brands that create strong connections between the brand and the self. When they do, and when the brand is prominent in their minds, they become psychologically attached to the brand, and display strong brand loyalty and advocacy behaviors. We use a grounded theory framework to ask if
employees
develop similar brand-self connections and regard the brand as prominent in their lives based on the meaning they attach to the brand they work for. This question is important because employee’s attachment to the brand can have critical equity-driving implications for the brand’s marketplace success and the employee’s commitment to the organization. We also ask what drives such outcomes. Beyond identifying novel drivers of employees’ brand attachment, we find that employees’ attachment to a brand is conceptually and empirically different from attachment or commitment to the organization. Specifically, we observe employees who are not attached to the organization but who are still attached to the brand, and who engage in difficult-to-enact pro-brand and pro-organization behaviors. Finally, our findings contribute to a broader knowledge base on organizational commitment and attachment by identifying brand meaning-related drivers of employees’ organizational commitment/attachment. Prior research has studied non-brand related drivers of these organizational outcomes."
Advancing conceptual-only articles in marketing,"Vargo, Stephen L. ;  Koskela-Huotari, Kaisa",Business Administration ;  Business and Management ;  Economics and Business ;  Editorial ;  Ekonomi och näringsliv ;  Företagsekonomi ;  Marketing ;  Samhällsvetenskap ;  Social Sciences,"AMS review, 2020, Vol.10 (1-2), p.1-5",
"Transaction cost theory: past, present and future","Rindfleisch, Aric",Alliances ;  Business and Management ;  Marketing ;  Social Sciences ;  Theory/Conceptual,"AMS review, 2020, Vol.10 (1-2), p.85-97","Transaction cost theory emerged over 80 years ago yet still continues to exert an important influence on marketing thought. In this article, I examine the past, present and future of this important theory by exploring the work of three of its key scholars: Ronald Coase, Oliver Williamson and Yochai Benkler. This examination provides an overview of each scholar’s ideas, a look at their intellectual influences, and an assessment of their impact on marketing scholarship. In addition to this in-depth exploration of transaction cost theory, I also highlight the contextual nature of how theories form, develop and change over time. My hope is that this examination will enrich our understanding of this important theory and suggest how it can be applied to a new set of marketing topics."
The “first principles” of marketing strategy,"Palmatier, Robert W. ;  Crecelius, Andrew T.",Business and Management ;  Market strategy ;  Marketing ;  Principles ;  Social Sciences ;  Theory/Conceptual,"AMS review, 2019, Vol.9 (1-2), p.5-26","The marketing domain has grown increasingly rich with data, frameworks, and analyses that enable marketers to craft and execute effective strategies, but they simultaneously represent a potential barrier to strategy formation due to their diversity and complexity. This article proposes a parsimonious organizing framework for marketing strategy decisions and the tools associated with each decision. This framework is grounded in four assumptions or first principles that guide the effectiveness of any marketing strategy: (1) All customers differ, (2) all customers change, (3) all competitors react, and (4) all resources are limited. By reviewing prior marketing research through the lens of these four principles, this article illustrates how marketing theory and practice can apply extant analyses and frameworks to support strategy decisions associated with each principle. The authors also theorize about how the four principles build on one another in a natural sequence to guide the formation and execution of marketing strategies."
Reimagining marketing doctoral programs,"Yadav, Manjit S.",Academic degrees ;  Business and Management ;  Commentary ;  Curricula ;  Graduate studies ;  Marketing ;  Social Sciences,"AMS review, 2020, Vol.10 (1-2), p.56-64","In this essay, my focus is on one critically important aspect of marketing doctoral programs: theory development. Theory animates everything we do in our discipline. Therefore, it is imperative that doctoral programs place theory at the heart of curriculum that shapes the thinking, priorities, and research efforts of our new scholars. Unfortunately, in many doctoral programs, this does not happen. To spur a conversation on this critically important issue in our discipline, I suggest five initiatives that seek to reimagine the content and structure of marketing doctoral programs. These initiatives are: (1) Add marketing to marketing doctoral programs; (2) Create a dedicated space in the curriculum for theory construction; (3) Restructure the sequence of doctoral seminars; (4) Make a foundational essay mandatory in dissertations; and (5) Change the culture of marketing doctoral programs."
Spillover effects in marketing: integrating core research domains,"Raufeisen, Xenia ;  Wulf, Linda ;  Köcher, Sören ;  Faupel, Ulya ;  Holzmüller, Hartmut H.",Business and Management ;  Celebrities ;  Co-branding ;  Corporate sponsorship ;  Endorsements ;  Literature reviews ;  Marketing ;  Social Sciences ;  Theory/Conceptual,"AMS review, 2019, Vol.9 (3-4), p.249-267","Spillover effects, i.e., a change in beliefs regarding one entity due to the evaluation of another associated entity (Ahluwalia et al.
Journal of Marketing Research
,
38
(4), 458–470, Ahluwalia et al.
2001
) is a core mechanism of a variety of marketing activities, such as brand extensions, co-branding, celebrity endorsements, and sponsorships. In this paper, we develop a comprehensive conceptualization of the spillover phenomenon and describe its underlying process. In addition, we review and consolidate relevant literature from different research domains, identify context-specific and overall factors that determine the occurrence of such effects, and discuss several methodological aspects that may become central considerations for future research in this field."
'First things first': The AMS Review – Sheth Foundation 2020 annual doctoral competition for conceptual articles,"Conduit, Jodie ;  Kleinaltenkamp, Michael",Business and Management ;  Editorial ;  Marketing ;  Social Sciences,"AMS review, 2020, Vol.10 (1-2), p.6-7",
Creativity and publication in marketing,"Stewart, David W.",Business and Management ;  Commentary ;  Creativity ;  Marketing ;  Scholarly publishing ;  Social Sciences,"AMS review, 2020, Vol.10 (1-2), p.65-72","The best academic publishing is an exercise in creativity and the more creative the work, the greater the long-term impact. It is, by definition, a high-risk/high return activity. Drawing on the literature on creativity, this paper describes the management of creative processes and develops implications for both the individual scholar and organizations that seek to facilitate high impact publication in marketing."
Sustainability in marketing: a systematic review unifying 20 years of theoretical and substantive contributions (1997–2016),"Lunde, Matthew B.",Business and Management ;  Marketing ;  Social Sciences ;  Sustainability ;  Systematic review ;  Theory/Conceptual,"AMS review, 2018, Vol.8 (3-4), p.85-110","A growing area of marketing research has surfaced in the past 20 years at the nexus of marketing and sustainability. However, a review of marketing literature shows that this field lacks conceptual and theoretical clarity. This article reviews research published on sustainability from 25 leading marketing journals between 1997 and 2016. It examines how theories used to frame sustainability in marketing literature have evolved. Additionally, no unified definition for sustainability exists in current marketing literature. To fill this void, the author proposes a new, holistic definition of sustainability in marketing, coined “sustainable marketing,” which is unique to the marketing discipline. Through presenting the GREEN Framework of Sustainable Marketing, the author conceptually and theoretically clarifies, unifies, and extends the current research. Finally, the systematic review explores implications for theory and practice and offers researchers, practitioners, and policymakers many opportunities for future research."
Contributing to theory: opportunities and challenges,"Barney, Jay B.",Business and Management ;  Commentary ;  Marketing ;  Social Sciences,"AMS review, 2020, Vol.10 (1-2), p.49-55","Scholars looking to make original theoretical contributions typically must address at least three challenges: Defining what constitutes an original theoretical contribution, positioning a paper in ongoing theoretical conversations, and critiquing prior published work. Based on experiences at the Academy of Management Review, approaches for addressing these challenges are discussed."
