Title,Authors,Keywords,Journal,Abstract
Designing conceptual articles: four approaches,"Jaakkola, Elina",Business and Management ;  Marketing ;  Social Sciences ;  Theory/Conceptual,"AMS review, 2020, Vol.10 (1-2), p.18-26","As a powerful means of theory building, conceptual articles are increasingly called for in marketing academia. However, researchers struggle to design and write non-empirical articles because of the lack of commonly accepted templates to guide their development. The aim of this paper is to highlight methodological considerations for conceptual papers: it is argued that such papers must be grounded in a clear research design, and that the choice of theories and their role in the analysis must be explicated and justified. The paper discusses four potential templates for conceptual papers – Theory Synthesis, Theory Adaptation, Typology, and Model – and their respective aims, approach for using theories, and contribution potential. Supported by illustrative examples, these templates codify some of the tacit knowledge that underpins the design of non-empirical papers and will be of use to anyone undertaking, supervising, or reviewing conceptual research."
A conceptual perspective on collaborative consumption,"Ertz, Myriam ;  Durif, Fabien ;  Arcand, Manon",Business and Management ;  Collaboration ;  Consumption ;  Marketing ;  Social Sciences ;  Theory/Conceptual,"AMS review, 2019, Vol.9 (1-2), p.27-41","While considerable investigative work has focused on collaborative consumption (CC) from a managerial standpoint, the concept still lacks the conceptual groundwork necessary to categorize and fully understand its scopes and limits. In this article, the authors draw upon past research to delineate the construct, discuss its dimensionalities, and propose a conceptualization of CC. The CC concept is based on six key thrusts: (1) the consumer’s ability to switch sides; (2) the collaboration intensity; (3) the manner in which consumers partake in CC; (4) the transfer of ownership and use; (5) the channels used; and (6) the extended range of stakeholders in collaborative exchanges. This analytical endeavour brings to the fore the multidimensional aspect of CC, the centrality of a two-sided instead of a one-sided consumer role, and the extent to which both CC (collaborative consumption) and conventional consumption (conventional economy) are tightly interrelated."
Toward a theory of ethical consumer intention formation: re-extending the theory of planned behavior,"Sun, William",Business and Management ;  Marketing ;  Social Sciences ;  Theory/Conceptual,"AMS review, 2020, Vol.10 (3-4), p.260-278","What drives consumers to purchase or not purchase ethical products remains something of a puzzle for consumer behavior researchers. Existing theory—particularly the widely applied theory of planned behavior (TPB)—cannot fully explain ethical purchase decisions. This article contends that not only is the original TPB limited in its applicability to ethical purchasing contexts but also subsequent modifications to it have been generally unfitting. This study advances the literature by taking a different approach to recharacterize and re-extend the original components of the TPB in order to make it more relevant and effective for explaining and predicting ethical consumer decisions. This new theoretical framework of intention formation features four determinants (attitude, subjective norm, moral identity, and perceived behavior control) and a key moderator (level of confidence), and thereby possesses better explanatory and predictive abilities to understand ethical consumer decisions."
Toward an integrative theory of marketing,"Parvatiyar, Atul ;  Sheth, Jagdish N.",Business and Management ;  Marketing ;  Social Sciences ;  Theory/Conceptual,"AMS review, 2021, Vol.11 (3-4), p.432-445","Many scholars have observed that the marketing discipline has become too fragmented and myopic, straying away from its core managerial marketing issues. To some, the complex discipline-transgressing phenomena are knowledge-producing, while for others, it is the discipline's problem of an identity crisis. This article argues that continuities and discontinuities of theoretical and methodological processes result from the contextual forces that continuously create new perspectives, paradigms, and schools of thought. Many traditional schools of marketing thought have either become obsolete or metamorphosized into new schools of thought. It has led to several theoretical advances that promise to develop into a general theory of marketing. However, none have grown into a full-blown integrative theory of marketing to tie in the various subdisciplines of marketing. We present an overall framework of marketing that could become the basis for developing an integrative theory of marketing with views relating to the core marketing processes and how the evolving contextual forces interactively impact them."
Marketing’s theoretical and conceptual value proposition: opportunities to address marketing’s influence,"Key, Thomas Martin ;  Clark, Terry ;  Ferrell, OC ;  Stewart, David W. ;  Pitt, Leyland",Business and Management ;  Conceptual ;  Conceptual and theoretical research ;  Discipline drift ;  Discipline myopia ;  Marketing ;  Marketing influence ;  Social Sciences ;  Theory ;  Theory/Conceptual,"AMS review, 2020, Vol.10 (3-4), p.151-167","This paper is composed of scholarly essays that explore the problematic nature of marketing’s influence within the academy and organizations, potential explanations and causes, and how conceptual and theoretical research can address and move our discipline forward. Each section represents material and research developed through interactive sessions from Academy of Marketing Science conferences. Topics include the history of the marketing discipline, its innovation and loss of domain expertise; important internal and external environmental concepts that have impeded relevance and theoretical impact; foundational elements of how the discipline frames problems, provides methodological-based solutions, and influences the very subjects of our research in such a way as to lesson our contribution to scholarship and practice; and finally the discipline’s inability to understand the intangible nature of marketing activities and outcomes, as well as marketers’ struggle to articulate relevance in a way that is easily understood in the language of finance. Through this critical self-examination of the field of marketing a central premise emerged—a discipline-wide drift and myopic approach to rigor and relevance."
Service innovation is urgent in healthcare,"Berry, Leonard L.",Business and Management ;  Innovations ;  Marketing ;  Social Sciences ;  Theory/Conceptual,"AMS review, 2019, Vol.9 (1-2), p.78-92","Healthcare is a service setting where meeting the needs of customers (patients and their families) is uniquely challenging. But the necessity, complexity, cost, and high-emotion nature of the service, as well as technological advances and competitive dynamics in the industry, make the imperative for
service innovation
in healthcare especially urgent. Forward-thinking healthcare institutions around the United States are succeeding in establishing a value-creating innovation culture and in implementing operational and strategic service innovations that benefit them and their stakeholders. They view continuous innovation as a non-negotiable goal, prize institutional self-confidence, and include patients and families on the innovation team. Cancer care, in particular, faces a pressing need for service innovation, and some progressive oncology centers are demonstrating what is possible to improve the patient and family service experience. The imperatives, now, are for service innovation to become part of the fabric of how all healthcare institutions, not just the groundbreakers discussed in this article, operate—and for academics in the field of marketing to play a crucial role in that effort."
Conceptual review papers: revisiting existing research to develop and refine theory,"Hulland, John",Business and Management ;  Marketing ;  Social Sciences ;  Theory/Conceptual,"AMS review, 2020, Vol.10 (1-2), p.27-35","Conceptual review papers can theoretically enrich the field of marketing by reviewing extant knowledge, noting tensions and inconsistencies, identifying important gaps as well as key insights, and proposing agendas for future research. The result of this process is a theoretical contribution that refines, reconceptualizes, or even replaces existing ways of viewing a phenomenon. This paper spells out the primary aims of conceptual reviews and clarifies how they differ from other theory development efforts. It also describes elements essential to a strong conceptual review paper and offers a specific set of best practices that can be used to distinguish a strong conceptual review from a weak one."
Theorizing markets,"Kjellberg, Hans ;  Murto, Riikka",Business and Management ;  Editorial ;  Marketing ;  Social Sciences,"AMS review, 2021, Vol.11 (3-4), p.207-215",
Consequences of mandated usage of innovations in organizations: developing an innovation decision model of symbolic and forced adoption,"Heidenreich, Sven ;  Talke, Katrin",Business and Management ;  Marketing ;  Social Sciences ;  Theory/Conceptual,"AMS review, 2020, Vol.10 (3-4), p.279-298","In organizations, mandated adoption contexts are the rule rather than the exception. Individuals, who are denied the choice between adopting and rejecting an innovation, are more likely to engage in opposition behavior, particularly if the innovation conflicts with their held beliefs. Interestingly, neither the construct of forced adoption nor its consequences have received much research attention. To address this gap, we conduct a systematic literature review and provide theoretical rationales for the emergence of innovation resistance and opposition behaviors in organizations. We then develop an innovation decision model of individual adoption behavior that localizes negative outcomes of the secondary adoption process along the different process stages, providing insights into their emergence and potential consequences for the organization. Furthermore, we identify important avenues for future research and show how our innovation decision model can be used to advance theory development on forced adoption."
Re-examining utopia in contemporary consumption: conceptualization and implications for marketing,"Atanasova, Aleksandrina",Business and Management ;  Conceptual ;  Desire ;  Escape ;  Experiential consumption ;  Liquid consumption ;  Marketing ;  Retailing ;  Social Sciences ;  Theory ;  Theory/Conceptual ;  Utopia,"AMS review, 2021, Vol.11 (1-2), p.23-39","This paper introduces liquid consumer utopias, defined as market-mediated expressions of individuals’ desires to re-imagine and re-construct reality, and to re-frame the present. This conceptual lens illuminates previously untheorized consumption phenomena, which are socially constructed, and often critical, efforts to enact an alternative way of being in an increasingly uncertain and unpredictable world. Three key characteristics of liquid utopias are outlined—immediacy, transience and hyper-individualization––each pointing to liquid consumer utopias’ function to facilitate present-oriented and short-lived re-imaginings of reality. Co-existing alongside the solid and collective utopian consumption of interest to prior research, these emergent forms of liquid consumer utopias articulate a re-imagining of the present (rather than the future), have an emphasis on individual (rather than communal) experiences of betterment, and an orientation toward temporary re-framings of the experienced reality (rather than a pursuit of permanence and long-lasting change). Implications are discussed for retailing, experiential consumption, and consumer self-optimization."
Sustainable marketing based on virtue ethics: addressing socio-ecological challenges facing humankind,"Dyck, Bruno ;  Manchanda, Rajesh V.",Business and Management ;  Conceptual ;  Ethics ;  Marketing ;  Marketing 4 Ps ;  Marketing-mix paradigm ;  Social Sciences ;  Sustainability ;  Theory ;  Theory/Conceptual ;  Triple Bottom Line ;  Utilitarian ethics ;  Virtue ethics,"AMS review, 2021, Vol.11 (1-2), p.115-132","It is generally accepted that the primary goal of marketing, even conventional sustainable marketing, is to enhance organizations’ financial well-being, a view that is consistent with mainstream utilitarian ethics. However, this profit-first focus often inadvertently contributes to socio-ecological problems and undermines the ability of marketing to adequately address resulting challenges. This paper presents an approach to sustainable marketing that we call Social and Ecological Thought (SET) marketing, which is based on virtue ethics and aims to optimize social and ecological well-being while ensuring financial viability. We describe implications of SET marketing for each of the 4 Ps in the marketing-mix paradigm—product, price, place, and promotion—and compare them to conventional views based on mainstream utilitarian ethics. SET marketing is relevant for the growing number of consumers and businesses that willingly forgo the maximization of financial well-being in order to optimize socio-ecological well-being. Implications for theory and practice are discussed."
The Möbius strip of market spatiality: mobilizing transdisciplinary dialogues between CCT and the marketing mainstream,"Coffin, Jack ;  Chatzidakis, Andreas",Business and Management ;  Marketing ;  Social Sciences ;  Theory/Conceptual,"AMS review, 2021, Vol.11 (1-2), p.40-59","This paper develops the Möbius strip as an ‘ordering theory’ (Sandberg and Alvesson,
2020
) that brings CCT studies into dialogue with mainstream marketing approaches. The aim is to work toward a transdisciplinary understanding of market spatiality, a topic that has become increasingly important for theorists and practitioners (Warnaby and Medway,
2013
; Castilhos et al., 
2016
; Chatzidakis et al., 
2018
). Building on psychosocial interpretations of the Möbius strip as a ‘tactical’ way of thinking, a range of insights and ideas are organized along a single strip of theorization. This paper maps a continuous plane of logic between the concepts of space, place, emplacement, spatiality, implacement, and displacement. The potential applications of the Möbius strip are then demonstrated by showing how the transdisciplinary topic of ‘atmosphere’ can be theorized from multiple perspectives. The paper concludes by exploring how the Möbius strip might also be employed in other areas of marketing theory and practice, potentially generating further transdisciplinary conversations between CCT and the marketing mainstream."
The new frontier of consumer experiences: escape through pain,"Cova, Bernard",Anti-structure ;  Business and Management ;  CCT ;  Conceptual ;  Consumers ;  Escape ;  Experience ;  Humanities and Social Sciences ;  Marketing ;  Orwell ;  Pain ;  Social Sciences ;  Theory ;  Theory/Conceptual ;  Whitening,"AMS review, 2021, Vol.11 (1-2), p.60-69","Terms such as
consumer experience
and
experiential consumption
have become ubiquitous in the realm of marketing. The last decades have seen a dramatic increase in academic publications exploring these concepts across many different streams and have resulted in significant advances in scholarly understanding. Consumer culture theory (CCT) scholars have particularly participated in this effort by investigating extraordinary experiences and framing them as escapes from everyday life. This paper proposes a summary of CCT contributions on extraordinary experiences and emphasizes the way these works have used the structural/anti-structural coexistence theory to depict the experiences consumers live through. Then it mobilizes a fiction to improve the understanding of escape. This paper highlights how painful leisure pursuits enable consumers to reconnect with their bodies, affording them moments of escape from an otherwise saturated self. The paper shows how the concept of self-escape is important to envision the possibilities in marketing painful experiences."
The influence of media multitasking on advertising effectiveness,"Garaus, Marion",Business and Management ;  Marketing ;  Social Sciences ;  Theory/Conceptual,"AMS review, 2020, Vol.10 (3-4), p.244-259","Recent years have seen an increasing trend among consumers toward using two or more media simultaneously, a phenomenon known as media multitasking. The majority of the extant literature agrees that media multitasking has detrimental effects on advertising effectiveness. However, opportunities exist for reducing these negative effects or even creating effects favorable to advertising outcomes. Nevertheless, the literature on media multitasking during advertising exposure is highly fragmented and findings are inconclusive. This literature review synthesizes the extant studies on message processing in media multitasking situations. It develops a comprehensive conceptual framework on the effects of media multitasking on advertising effectiveness, with particular attention to mediating processes and moderating variables. The conceptual model explains the circumstances under which individuals devote voluntary or involuntary attention to advertisements during media multitasking, advances knowledge on the role of different sensory modalities, and reveals how the two types of information processing complement each other during simultaneous media usage."
Rethinking marketing: back to purpose,"Fehrer, Julia A.",Business and Management ;  Commentary ;  Grand challenges ;  Market shaping ;  Marketing ;  Marketing myopia ;  Social Sciences ;  Systems thinking ;  Value cocreation,"AMS review, 2020, Vol.10 (3-4), p.179-184","Key and colleagues raise some serious criticisms related to the marketing discipline’s purpose drift and short-sighted approach to rigor and relevance. They provide a comprehensive and nuanced picture of the grand challenges in marketing, including the loss of domain expertise, detachment from real-world phenomena, nurturing of methodological monocultures and more generally a perception problem in academia and management practice. This commentary complements their assessment by reviewing strands of literature in the niches and at the edge of mainstream marketing, where we may find some solutions or at least seeds for solutions as a starting point to refine, recalibrate and potentially reshape the future of marketing and marketing research."
Indigenous theory development in marketing: the foundational premises approach,"Hunt, Shelby D.",Business and Management ;  Marketing ;  Social Sciences ;  Theory/Conceptual,"AMS review, 2020, Vol.10 (1-2), p.8-17","Marketing’s intellectual health requires indigenous theory development. However, marketing is a discipline that, almost exclusively, imports its concepts and theories from other disciplines and applies them to marketing issues. Articles that either
develop
indigenous marketing theory or
use
such theory as a foundation for empirical research are notably absent from marketing journals. A major reason for the absence of indigenous marketing theory is the lack of well-developed procedures and approaches for developing theories and writing conceptual articles. This article proposes, explicates, and illustrates with a concrete example (i.e., service-dominant (S-D) logic) an approach to theory development in marketing that is labeled the “foundational premises, inductive realist approach.” Although this approach is not an algorithmic procedure for theory development, it can provide a valuable conceptual framework for furthering the development of indigenous marketing theory."
A service design approach to healthcare innovation: from decision-making to sense-making and institutional change,"Patrício, Lia ;  Grenha Teixeira, Jorge ;  Vink, Josina",Business and Management ;  Commentary ;  Decision making ;  Marketing ;  Social Sciences,"AMS review, 2019, Vol.9 (1-2), p.115-120","Healthcare is facing complex challenges that demand profound service system innovation. Service design offers an opportunity to move beyond explanatory research and take an action-oriented approach that combines research rigor with relevance to foster innovation in healthcare. We present three research projects that illustrate different ways service design can enable health service system innovation to create uplifting changes in wellbeing. The first research project utilizes a decision-making approach to support design teams in developing value co-creating technology-enabled services for skin cancer prevention. The second project employs a sense-making approach through participatory design to develop a National Electronic Health Record that addresses the multiple and conflicting goals of healthcare network actors. The third project uses an institutional change approach to develop a new digital service for youth with mental health issues while simultaneously shifting the culture of the clinic toward people-centered care through participatory service design. We conclude with research directions to leverage the potential of service design for healthcare innovation, including strengthening the dialogue between explanatory and design research, exploring new multidisciplinary collaborations and integrating multiple research methods."
Multiple stakeholder market orientation: a service-dominant logic perspective of the market orientation paradigm,"Line, Nathaniel D. ;  Runyan, Rodney C. ;  Gonzalez-Padron, Tracy",Business and Management ;  Business ethics ;  Market orientation ;  Marketing ;  Social Sciences ;  Stakeholders ;  Theory/Conceptual,"AMS review, 2019, Vol.9 (1-2), p.42-60","The purpose of this research is to propose a comprehensive conceptualization of the market orientation construct that acknowledges the role of salient stakeholders in value co-creation. The proposed multiple stakeholder market orientation (MSMO) construct is a more broadly defined conceptualization of what it means to implement the marketing concept in a multi-stakeholder business environment. The construct is developed within the context of prevailing theoretical perspectives including the service-dominant logic of marketing, stakeholder theory, and the market orientation paradigm. Specifically, the construct is developed as an interconnected operant resource consisting of a stakeholder orientation, a systems orientation, and a shared value orientation."
Market-shaping: navigating multiple theoretical perspectives,"Nenonen, Suvi ;  Storbacka, Kaj",Business and Management ;  Marketing ;  Social Sciences ;  Theory/Conceptual,"AMS review, 2021, Vol.11 (3-4), p.336-353","There is an increasing managerial and scholarly interest in the agential efforts of firms, consumers, public actors, and various collectives to influence market formation and transformation. Determining the essence of market-shaping requires an understanding of who is engaged in the shaping, what is being shaped, and how the shaping efforts are performed. To support making more informed choices about which theories to use when examining this phenomenon, we provide an overview of seven theoretical perspectives, illuminating their conceptual underpinnings and relative strengths. Building on this, we discuss how these perspectives can be used to examine market-shaping, highlighting its typical variations. The paper concludes by a call for greater explicitness, compatibility and parsimony when choosing theoretical perspectives for market-shaping research, and by identifying avenues for further research."
The intermingling of meanings in marketing: semiology and phenomenology in consumer culture theory,"Grace, Sarah C.",Business and Management ;  Culture ;  Marketing ;  Phenomenology ;  Semiotics ;  Social Sciences ;  Theory/Conceptual,"AMS review, 2021, Vol.11 (1-2), p.70-80","This paper explores the construction of meaning in consumer culture through a synthesis of two scholarly streams within the Consumer Culture Theory (CCT) body of knowledge: semiology and phenomenology. Semiology represents consumer culture as a web of meanings—studying cultural meanings as socially agreed-upon structures.  By contrast, phenomenology represents the interpretation and personalization of cultural meanings by consumers—focusing on meanings that emerge from individual lived experience. Combining these two approaches results in a framework that excavates meanings at both the cultural level and the individual level, inviting them into a figure-ground relationship. This relationship between levels of analysis illuminates how meaning in consumer culture is constructed, and how cultural meanings come to constitute a sense of normalcy in modern societies. As all marketing activity is culturally situated, understanding meaning in consumer culture provides an alternative way to understand value in marketing."
