Title,Authors,Keywords,Journal,Abstract
Advancing theory in marketing: insights from conversations in other disciplines,"Varadarajan, Rajan",Business and Management ;  Commentary ;  Marketing ;  Social Sciences,"AMS review, 2020, Vol.10 (1-2), p.73-84","Over the years, marketing scholars have voiced concerns regarding the dearth of indigenous theory development in marketing, reliance on theories developed in other disciplines, and the downward trend in conceptual articles published in marketing journals. Advancing marketing theory encompasses developing organic marketing theories, refining and extending theories developed in other disciplines used to explain and predict marketing phenomena, evaluating theories currently in vogue in the field and discarding flawed theories, and developing overarching theories that in addition to explaining marketing phenomena also explain a broader range of phenomena that transcend disciplinary boundaries. Along the lines of the demonstrated potential of theories developed in other disciplines to shed light into marketing phenomena, the potential of organic marketing theories to shed light into phenomena that are the focus of research in other disciplines also merit exploration. Against this backdrop, drawing on theory insights from marketing literature and other disciplines, this commentary focuses on issues relating to development of new theories, extensions and revisions of theories in vogue, and discarding of flawed theories."
Information transparency as competitive advantage: research approaches to platform ecosystem design and competition,"Key, Thomas Martin ;  Challagalla, Goutam",Business and Management ;  Commentary ;  Competitive advantage ;  Marketing ;  Social Sciences,"AMS review, 2020, Vol.10 (1-2), p.145-147",This paper explores a research agenda based on the Jaworski and Patel ( 2020 ) interview.
"Reinventing professional service firms: the migration to a client-facing, talent-on-demand platform","Jaworski, Bernard J. ;  Patel, Ajay",Business and Management ;  Marketing ;  Social Sciences ;  Theory/Conceptual,"AMS review, 2020, Vol.10 (1-2), p.135-144",
The journey towards customer centricity and service growth in B2B: a commentary and research directions,"Ulaga, Wolfgang",Business and Management ;  Commentary ;  Marketing ;  Social Sciences,"AMS review, 2018, Vol.8 (1-2), p.80-83",
Marketing’s identity crisis: insights from the history of marketing thought,"El-Ansary, Adel ;  Shaw, Eric H. ;  Lazer, William",Business and Management ;  Marketing ;  Social Sciences ;  Theory/Conceptual,"AMS review, 2018, Vol.8 (1-2), p.5-17","For almost half a century the broadening and generic concepts of marketing have been the dominant paradigm in the marketing discipline. However, ambiguities in that paradigm have hindered development of a general theory of marketing. This research takes a fresh look at these concepts that some academics regard as causing an identity crisis in marketing. Historical analysis reveals many practical applications, which arise from the broadening/generic paradigm, result in unresolvable theoretical anomalies. Consequently, a new paradigm is proposed. Marketing systems, we argue, provides a logically coherent foundation for building a general theory of marketing."
Researching marketing capabilities: reflections from academia,"Morgan, Neil A.",Business and Management ;  Commentary ;  Marketing ;  Social Sciences,"AMS review, 2019, Vol.9 (3-4), p.381-385",
"The contingent value of pay inequalities in sales organizations: integrating literatures in economics, management, and psychology","Rouziou, Maria",Business and Management ;  Marketing ;  Salespeople ;  Social Sciences ;  Theory/Conceptual,"AMS review, 2019, Vol.9 (3-4), p.184-204","Pay-for-performance compensation systems are often employed in sales organizations and can potentially lead to pay inequalities. With increased transparency of employees’ pay outcomes stemming from CRM and related technologies, salespeople now have ample opportunity to observe these inequalities, compare their pay with that of others, and make fairness assessments. These comparisons and assessments then have implications in terms of utility, behaviors, and performance of salespeople, which have scarcely been explored in the sales or marketing literature. This article considers research on pay inequality from three other fields – economics, management, and psychology – and highlights relevant issues in sales contexts. Furthermore, the article provides scholars with a resource that elaborates on the nature of pay inequalities and their multiple outcomes on individual and organizational performance, as well as noting their likely antecedents and moderators."
Expanding exchange: how institutional actors shape food-sharing exchange systems,"Jayashankar, Priyanka ;  Cross, Samantha",Business and Management ;  Food ;  Marketing ;  Social Sciences ;  Theory/Conceptual,"AMS review, 2020, Vol.10 (1-2), p.116-134","In this conceptual paper, we offer a revised perspective of exchange which is relevant across diverse institutional and economic contexts. We discuss and compare food sharing exchange systems in India and the US. We focus on the antecedents and drivers of food sharing exchange systems, the processes by which institutional actors influence food sharing exchange systems and the underlying reasons due to which food-sharing systems emerge. Our work substantively builds on the extant literature on the theory of exchange and institutional theory in marketing. We develop a compelling exchange narrative of how institutional actors can drive consumer welfare across diverse exchange systems."
"The digital continuum: the influence of ownership, access, control, and Cocreation on digital offerings","Micken, Kathleen S. ;  Roberts, Scott D. ;  Oliver, Jason D.",Business and Management ;  Marketing ;  Social Sciences ;  Theory/Conceptual,"AMS review, 2020, Vol.10 (1-2), p.98-115","Digital offerings have provided new ways to experience what once were physical products. Such offerings have upended business processes by being less costly for firms to produce, store, and distribute. The ways in which consumers access them and interact with them have called into question traditional notions of ownership, access and control. This paper extends the thinking about digital offerings by proposing a Digital Continuum framework: a conceptual model anchored at one end by Digital Products and at the other by Digital Services. We discuss the benefits and costs that accrue to both consumers and firms along the Continuum that result from differences in ownership, access, control and customization/cocreation."
Effective reviewing for conceptual journal submissions,"Griffin, Abbie ;  Barczak, Gloria",Business and Management ;  Marketing ;  Quality ;  Social Sciences ;  Theory/Conceptual,"AMS review, 2020, Vol.10 (1-2), p.36-48","Peer reviewed academic journals, like
AMS
Review, live and die by their ability to obtain high quality reviews of submitted manuscripts. However, academics are increasingly pressed for time, needing to publish their research, teach their classes, and provide service to their Department, Faculty/College and University to support their careers in terms of retention, tenure, and promotion. Amidst these responsibilities, as a service to the Academy, academics also are expected to provide reviews of manuscripts in order to move the intellectual trajectory of the domain forward. High quality reviewing, though, takes cognitive energy and is time consuming, which then interferes with other academic responsibilities. For these reasons, editors of peer-reviewed academic journals are finding it more and more difficult to obtain a sufficient number of high-quality reviews to make good decisions about submissions in a timely manner. The purpose of this article is to help
all
reviewers, but especially those reviewing conceptual articles, provide a high-quality review. Specifically, this article first defines what constitutes a “high quality review,” and suggests how reviewing can aid an academic’s own research, writing and career. It then defines the behaviors needed for effective reviewing for all manuscripts, termed the 5 R’s: roles, responsibilities, responses, reactions, and respect. It then provides a reviewing template for conceptual articles, given the special difficulties of peer reviewing such articles, and closes with a few additional pieces of advice to help with being efficient in reviewing, while being effective."
Moving forward,"Vargo, Stephen L.",,"AMS review, 2019, Vol.9 (3-4), p.133-135",
The innovation imperative in healthcare: an interview and commentary,"Mende, Martin",Business and Management ;  Chief executive officers ;  Marketing ;  Social Sciences ;  Theory/Conceptual,"AMS review, 2019, Vol.9 (1-2), p.121-131","This two-part submission draws on Len Berry’s lead article in this Special Issue on Innovation in Healthcare. The first part includes an interview with Robert G. Riney, Chief Operating Officer and President, Healthcare Operations at Henry Ford Health System. The second part, a brief commentary, supplements this interview and points to three fertile avenues for marketing research. Specifically, it proposes (1) that more empirical research is needed on the effects that dedicated innovation units have in service organizations, (2) that the customer participation literature in marketing can benefit from expanding its current research lens, and (3) that marketing research can contribute to the discussion of how to use robots in healthcare and other service industries."
The promise of shared decision making in healthcare,"Steffensen, Karina Dahl",Business and Management ;  Commentary ;  Decision making ;  Marketing ;  Social Sciences,"AMS review, 2019, Vol.9 (1-2), p.105-109","The number of people with chronic or long-term physical and mental illnesses has increased and will continue to do so. Many must learn to live with one or more diseases throughout their lives. Healthcare service must therefore support, to a greater extent, individuals living with illness. An important part of this transition is to improve the use of patients’ knowledge and resources to organize treatment in accordance with their own needs and values. Patient-centered healthcare can provide better patient experiences, better professional quality, and the possibility of slowing down resource consumption. Therefore, patient-centered initiatives have taken center stage in discussions on how to improve quality in healthcare service as discussed by Berry (2019) in this issue of the AMS Review. A cornerstone of patient-centered care is shared decision making, where healthcare professionals and patients work together to reach a shared healthcare choice."
About time in marketing: an assessment of the study of time and conceptual framework,"Carlson, Jeffrey R. ;  Ross, William T. ;  Coulter, Robin A. ;  Marquardt, Adam J.",Business and Management ;  Marketing ;  Social Sciences ;  Theory/Conceptual,"AMS review, 2019, Vol.9 (3-4), p.136-154","An inspection of time-related research in marketing documents two dominant conceptualizations of time: objective time and subjective time. Objective time is straightforward, and refers to clock time. In contrast, subjective time is quite nuanced and refers to the differential experience and perception of time. Recognizing this distinction, a number of scholars have suggested that the marketing discipline relies upon objective time, and as a result, does not have a fully developed understanding of time. Conducting a historical assessment of time, we demonstrate that marketing has a conceptually-bounded view of time. We develop a conceptual framework that reconceptualizes time as objective and subjective and as experienced by multiple referents, and develop research propositions that highlight the importance of integrating a broadened view of time into marketing research, recognizing that we are better off thinking about time as objective time and subjective time. We conclude with a discussion highlighting future research opportunities."
"Empowerment in marketing: synthesis, critical review, and agenda for future research","Bachouche, Hajer ;  Sabri, Ouidade",Business administration ;  Business and Management ;  Empowerment ;  Humanities and Social Sciences ;  Marketing ;  Social Sciences ;  Theory/Conceptual,"AMS review, 2019, Vol.9 (3-4), p.304-323","We comprehensively review consumer empowerment, which has received increasing attention from academics and has given rise to inconsistent theoretical frameworks. Building on a multidisciplinary approach and a review of power models, we begin with a conceptualization of empowerment, identifying the concept’s contours and origins. Then, we show how multidisciplinary advancements influence the marketing discipline through an assessment of the empowerment literature. We reveal important knowledge gaps on the topic related to different theoretical orientations and various levels of analysis and context. We then propose an organizing framework to help understand the underlying mechanisms induced in psychological empowerment by changes in the market structure and technological shifts, consumer-to-firm, state-to-consumer, and firm-to-consumer deliberate actions. Our critical review of the marketing literature reveals the limits of prior research, and we suggest directions for future theoretical and empirical research on the consumer empowerment theme."
AMS Review: Progress toward a world-class journal dedicated to theory development,"Yadav, Manjit S.",Business and Management ;  Editorial ;  Marketing ;  Social Sciences,"AMS review, 2019, Vol.9 (1-2), p.1-4",
Cost-effective service excellence in healthcare,"Wirtz, Jochen",Business and Management ;  Commentary ;  Cost analysis ;  Health care industry ;  Marketing ;  Operations management ;  Quality of care ;  Quality of service ;  Social Sciences,"AMS review, 2019, Vol.9 (1-2), p.98-104","Berry
AMS Review
,
9
(1–2), (
2019
) highlights the urgent need for innovation in healthcare as cost pressure is intense and service quality, both in terms of objective care and treatment quality, is critical for the wellbeing of our societies. Yet, administrative and operational waste is prevalent and service quality leaves much to be desired in many healthcare institutions. This commentary draws on the article by Wirtz and Zeithaml
Journal of Service Management
,
29
(5), 907–931, (
2018
) and discusses how three strategic pathways towards cost-effective service excellence (CESE) can be applied to healthcare. CESE is defined as achieving low unit costs (i.e., high productivity) while at the same time delivering service quality (i.e., service excellence) at an industry-leading level. The three pathways are the
dual culture strategy
, the
operations management approach
, and the
focused service factory strategy
. Implications for innovation in healthcare are discussed."
"For service innovation in end-of-life care, branding and messaging matter","Stuart, Brad",Business and Management ;  Commentary ;  Innovations ;  Marketing ;  Older people ;  Palliative care ;  Patient care planning ;  Patients ;  Social Sciences,"AMS review, 2019, Vol.9 (1-2), p.110-114","Many patients over 65 with advanced chronic illness undergo medical treatment that fails to align with their preferences as the end of life approaches. In particular, unwanted hospitalizations increase in number and duration, a pattern of overtreatment that not only violates patient choice but also constitutes preventable medical waste. Existing services that align care with patient preference are underused, in part because both physicians and patients associate them with dying and denial of treatment. An innovative program developed at Sutter Health, a large integrated system in Northern California, illustrates how to remedy this situation. Nurse-led teams bring care to the residences of more than 2000 patients with advanced illness each day, increasing the quality of their care, reducing hospitalizations and lowering costs. Program branding and messaging has led to widespread acceptance, and the initiative has become a foundational component of a new Medicare payment model. Skillful branding and messaging of service innovation initiatives can help to overcome the emotional and attitudinal barriers restricting the use of current service lines, changing the focus of care for seriously-ill people from the hospital to their homes."
"The new era of service: new roles, new places and new partnerships","Bisognano, Maureen",Business and Management ;  Commentary ;  Health care industry ;  Innovations ;  Marketing ;  Social Sciences,"AMS review, 2019, Vol.9 (1-2), p.93-97","Healthcare is in an unprecedented time of change. Our aging population experiences more chronic disease. The rapid expansion of technology and AI learning in diagnostics and care offer opportunities to think and care in new ways. We are learning from an unprecedented amount and speed of research production. Spreading new models of care quickly and reliably is on the agenda for all senior leaders. We have more diversity in the workforce, with five distinct generations for the first time in history. And increasingly, patients will be co-designers in the health and care. Our work today clearly needs innovations and new ways to think about health and care."
Pricing co-created value: an integrative framework and research agenda,"Read, Stuart ;  Michel, Stefan ;  Schumann, Jan H. ;  Ranjan, Kumar Rakesh",Business and Management ;  Collaboration ;  Customers ;  Marketing ;  Pricing policies ;  Social Sciences ;  Theory/Conceptual ;  Value added,"AMS review, 2019, Vol.9 (3-4), p.155-183","Two-sided markets, free pricing, and offerings with network externalities represent exciting variations in the market. And while all embody theoretical advancements in marketing describing situations where firms and customers collaborate in the co-creation of value, heretofore they have received limited exploration in fundamental models of pricing. Seeking to fill this gap, we delve into the co-creation literature in search of conceptual building blocks. From a detailed review, we identify six distinct mechanisms underlying value created by customers but absent from existing pricing models. In the course of their co-creative interactions with firms, customers can provide knowledge, innovation, attention, effort, quality and additional revenue to firms. We proceed to construct a model of price determination which incorporates elements of co-creative value from customers and elaborate real world applications of the model. The conceptual and practical implications of incorporating co-creation into pricing are far-reaching and we offer directions for both audiences."
Building marketing capabilities: principles from the field,"Jaworski, Bernard J. ;  Lurie, Robert S.",Business and Management ;  Marketing ;  Social Sciences ;  Theory/Conceptual,"AMS review, 2019, Vol.9 (3-4), p.372-380",
The ultimate co-creation: leveraging customer input in business model innovation,"Kim, Shinhye ;  Bowen, Melanie ;  Wen, Xiaohan (Hannah)",Business and Management ;  Business models ;  Customer feedback ;  Marketing ;  Social Sciences ;  Theory/Conceptual,"AMS review, 2019, Vol.9 (3-4), p.339-356","In order to stay competitive, organizations need to regularly revamp and innovate their business model (BM). A key catalyst for innovation—acknowledged by managers as well as academics—is input from customers. However, the functional aspect of customer input in the process of business model innovation (BMI) is still ambiguous. In this paper, we explore the role of customers in the process of BMI and propose a conceptual model that links customer input to BMI success. Particularly, our model demonstrates how customer input is generated and how organizations can efficiently and effectively manage such input to enhance the performance of their newly innovated BM. This proposed model provides managers with a basis for developing actionable plans to reach customers, utilize their input during the BMI process, and enhance BMI success."
Complex systems: marketing’s new frontier,"Rand, William ;  Rust, Roland T. ;  Kim, Min",Business and Management ;  Complex systems ;  Marketing ;  Researchers ;  Social Sciences ;  Theory/Conceptual,"AMS review, 2018, Vol.8 (3-4), p.111-127","Complex systems approaches are emerging as new methods that complement conventional analytical and statistical approaches for analyzing marketing phenomena. These methods can provide researchers with tools to understand and predict marketing outcomes that emerge at the aggregate level by modeling feedback between heterogeneous agents and agent interaction with various marketing environmental variables. While the benefits of complex systems approaches often come with a high computational cost, steady advances in access to better computational resources has allowed more researchers to adopt complex systems approaches as part of their portfolio of methods. In this paper, we will provide a description of the key concepts, benefits, and tools of complex systems. The goal of this work is to encourage marketing researchers and practitioners who are not familiar with these approaches to consider the adoption of these methods. We end with a discussion of the future research opportunities that this powerful methodology enables."
Toward an improved conceptual understanding of consumer ambivalence,"Sipilä, Jenni ;  Tarkiainen, Anssi ;  Sundqvist, Sanna",Business and Management ;  Consumption ;  Marketing ;  Social Sciences ;  Theory/Conceptual,"AMS review, 2018, Vol.8 (3-4), p.147-162","Despite the significance of ambivalence in consumer research, the concept suffers from a lack of clarity. This study thus aims to develop an improved conceptual understanding of consumer ambivalence based on the analysis of existing definitions. A number of challenges are observed and addressed through key premises that characterize the concept of consumer ambivalence. Furthermore, the presented conceptualization is contextualized into the area of consumption. The result of this process is an enhanced view of consumer ambivalence that builds on and extends earlier conceptualizations in 1) recognizing a wide variety of concepts that can be studied under the umbrella of consumer ambivalence, 2) specifying the multitude of objects of consumer ambivalence, and 3) specifying the temporal scope of consumer ambivalence through the concept of consumption episodes. The proposed conceptualization accommodates the richness of different approaches to consumer ambivalence and thus contributes to a wide range of consumer research."
THE DATA HIERARCHY: factors influencing the adoption and implementation of data-driven decision making,"Sleep, Stefan ;  Hulland, John ;  Gooner, Richard A.",Big Data ;  Business and Management ;  Decision making ;  Marketing ;  Social Sciences ;  Theory/Conceptual,"AMS review, 2019, Vol.9 (3-4), p.230-248","Marketing practitioners have access to a rapidly increasing quantity and variety of data from customers and other stakeholders. Managers use the term “Big Data” to describe this avalanche of information, which many view as critical to providing a better understanding of customers and markets. This research uses interviews with managers to examine the marketing function’s perspective on data-driven decision making within the firm. Based on informant responses, we develop a hierarchy of data-oriented decision making, describe the drivers that influence where a firm falls within this hierarchy, and detail several transition capabilities for marketing managers interested in becoming more data-driven. The key factors that influence the level of data driven decision making are: 1) firm environment; 2), competition, 3) executive commitment, 4) interdepartmental dynamics, and 5) organizational structure. This framework guides marketing managers both in evaluating the firm’s data capabilities and facilitating change."
"The extended self, product valuation, and the endowment effect","Villanova, Daniel",Business and Management ;  Consumer behavior ;  Consumer goods ;  Endowment ;  Marketing ;  Social Sciences ;  Theory/Conceptual ;  Valuation,"AMS review, 2019, Vol.9 (3-4), p.357-371","Various explanations have been proposed to account for discrepancies in product valuation, pertaining particularly to the buyer-seller valuation gap called the endowment effect. Previous research has examined the roles of loss sensitivity, strategic responding, differences between buyers and sellers in information processing, self-enhancement, and psychological ownership as causes of the endowment effect. This article presents a conceptual perspective based on the theory of the extended self that integrates previously proposed mechanisms for the endowment effect. The self-extension perspective generates novel predictions about possible moderators of the endowment effect. Further, the self-extension perspective also raises questions for product valuation in general. By integrating previous research and posing new questions, the self-extension perspective provides a new base for the advancement of research on product valuation."
