Title,Authors,Keywords,Journal,Abstract
From customer journeys to consumption journeys: a consumer culture approach to investigating value creation in practice-embedded consumption,"Schau, Hope Jensen ;  Akaka, Melissa Archpru",Business and Management ;  Marketing ;  Social Sciences ;  Theory/Conceptual ;  Value creation,"AMS review, 2021, Vol.11 (1-2), p.9-22","Prior research on customer journeys chiefly focuses on identifying, from the firm perspective, firm-customer touchpoints. Importantly, the extant literature begins to maps aggregate firm-customer interactions over time to reveal how sequenced firm-controlled touchpoints contribute to customer experience. These customer journey maps tend to emphasize market actions, specifically purchases, over other, customer-centric touchpoints like use occasions, use experiences, storage and disposal. We extend the firm-centric
customer journey
framework to consider customer-centric touchpoints within a broader social and cultural context for value creation. We propose a consumer-centric
consumption journey
which considers consumption within progressive engagement with a practice or set of practices. We offer a culturally grounded consumption journey framework that highlights the importance of practices, communities, and institutions in value creation, and reveals various experiences and value outcomes. Future research regarding consumption journeys can advance understanding of customer experiences and journeys by investigating a variety of sociocultural influences and outcomes of value creation."
For re-institutionalizing the marketing discipline in Era V,"Hunt, Shelby D.",Business and Management ;  Marketing ;  Social Sciences ;  Theory/Conceptual,"AMS review, 2020, Vol.10 (3-4), p.189-198","Commentaries on the status of the marketing discipline conclude that it is significantly troubled, which raises the question: Do the troubles identified portend a de-institutionalization of the discipline in marketing’s Era IV (1980–2020) and its potential re-institutionalization in Era V (2020-?)? This article examines (1) the marketing discipline’s founding in Era I (1900–1920), (2) how the discipline became institutionalized in Era II (1920–1950), (3) how marketing was re-institutionalized in Era III (1950–1980), and (4) how the discipline’s fragmentation in Era IV (1980–2020) portends its de-institutionalization. The article concludes by arguing for the marketing discipline’s re-institutionalization in Era V (2020-?)."
Friendships in marketing: a taxonomy and future research directions,"Banerji, Diptiman ;  Singh, Ramendra ;  Mishra, Prashant",Business and Management ;  Marketing ;  Social Sciences ;  Theory/Conceptual,"AMS review, 2020, Vol.10 (3-4), p.223-243","The concept of friendship remains important from societal, academic, and practitioner perspectives. We find that there is a proliferation of research in the marketing discipline on the utilization and applicability of the concept of friendship, but the literature is fragmented. By fragmentation, we refer to the fact that the notion of friendship is tapped in multiple, independent research streams. As a result, there is a lack of an organized and holistic view of friendship-related research in the marketing domain. Drawing on an extensive literature review of 130 papers in more than 30 peer-reviewed scholarly journals across a 37-years time span (1980–2017), this paper synthesizes the extant friendship research in the domain of marketing through a taxonomy, which categorizes the different types of friendship conceptualizations based on two underlying characteristics, or dimensions, the formation of friendship, and consumption timeline. The proposed taxonomy shows the differences as well as the interrelationships between the different publications, giving a systematic view of the research landscape. We suggest future research avenues as well, for further research in the area of marketing-related friendships and highlight why the research is relevant from a real-world perspective."
Resurrecting marketing,"Belk, Russell",Abductive logic ;  Algorithims ;  Analytics ;  Big data ;  Business and Management ;  Co-creation ;  Commentary ;  Disruptive innovation ;  Distributed brands ;  Imitation ;  Marketing ;  Marketing RIP ;  Social Sciences,"AMS review, 2020, Vol.10 (3-4), p.168-171","Marketing lays dying, felled by two fatal blows: 1) the shift in control of brands from marketer to consumer; and 2) the shift of many marketing functions from marketing to Big Data, algorithms, and data analytics. To resurrect marketing, we need to fundamentally refocus on marketing in a digital age."
Innovation and the theory of fields,"Fligstein, Neil",Alliances ;  Business and Management ;  Government sponsored enterprises ;  Innovations ;  Marketing ;  Social Sciences ;  Theory/Conceptual,"AMS review, 2021, Vol.11 (3-4), p.272-289","Innovation does not just involve the creation of new products, but also includes the need for new kinds of processes and organizations. Field theory can help us understand why some innovations are more piecemeal and others more revolutionary. It explicitly links innovation to the process of the emergence, adjustment, and transformation of markets (conceived of as fields). To illustrate this perspective, the case of the transition in the U.S. from a mortgage market dominated by savings and loan banks to the emergence of mortgage securitization dominated by the government sponsored enterprises and the largest private banks, is explicated. Field theory helps us understand the logic of this transition and the myriad players and innovations that helped produce a large part of what we consider to be modern finance. The case also shows the limits of economic theories of financial innovation and the sociology of finance. I end with a discussion of how field theory can inform subsequent research on innovation."
Formalizing service-dominant logic as a general theory of markets: taking stock and moving forward,"Akaka, Melissa Archpru ;  Koskela-Huotari, Kaisa ;  Vargo, Stephen L.",Academic marketing ;  Business and Management ;  Marketing ;  Social Sciences ;  Theory/Conceptual,"AMS review, 2021, Vol.11 (3-4), p.375-389","Advancement of the marketing discipline requires a marketing-based, general theory of markets. However, most academic marketing is developed from normative theories of economics and direct application of psychological and sociological theories. Indigenous marketing theories about markets are rare but can increase the relevance of marketing scholarship. Although theories are never fully finalized, theoretical formalizing processes can establish a general framework for theory development on markets. The aim of this paper is to provide a conceptual base for a general theory of markets by explicating the ongoing progression toward formalization of service-dominant (S-D) logic. We outline a recursive, cocreative process of theory formalization to take stock of the status of S-D logic’s development so far—what has been done and what we know and don’t know about markets. We propose specific areas of inquiry and research directions for moving forward in developing a general theory of markets that is indigenous to marketing."
Legendary luxury brands: inventing the future by reaching to the past,"Carpenter, Gregory S. ;  Barlier, Xavier",Business and Management ;  Marketing ;  Social Sciences ;  Theory/Conceptual,"AMS review, 2021, Vol.11 (3-4), p.464-470","Unlike many other brands, luxury brands can enjoy remarkably enduring success. This paper presents an interview with a senior executive responsible for marketing Maison Louis Roederer’s champagnes, including the legendary Cristal, in the United States for the last 20 years. We explore the differences between luxury and mass-market brands, the role of creative vision, how brands remain relevant through innovation while remaining faithful to their history, and how luxury brands create passionate buyers who seek to be a part of the brand, not simply consumers of the brand. We conclude with a discussion of the implications for market orientation, understanding consumers as fans, and other future research topics."
The past and future of marketing theory and practice: a tribute to the 50th anniversary of the Academy of Marketing Science,"Ferrell, O. C. ;  Conduit, Jodie ;  Edvardsson, Bo ;  Vargo, Stephen L.",Business Administration ;  Business and Management ;  Economics and Business ;  Editorial ;  Ekonomi och näringsliv ;  Företagsekonomi ;  Marketing ;  Samhällsvetenskap ;  Social Sciences,"AMS review, 2021, Vol.11 (3-4), p.390-394",
Is sustainable marketing based on virtue ethics the answer to addressing socio-ecological challenges facing humankind?,"Prothero, Andrea ;  McDonagh, Pierre",Business and Management ;  Commentary ;  Ecofeminism ;  Ethics ;  Marketing ;  Marketing 4Ps ;  Marketing mix paradigm ;  Social Sciences ;  Sustainability ;  Virtue ethics,"AMS review, 2021, Vol.11 (1-2), p.134-139","This commentary provides a review of Dyck and Manchanda’s work on the use of virtue ethics, through Sociological and Ecological Thought (SET) Oriented Marketing, in tackling socio-ecological challenges within society. While we concur with the focus of the paper on moving away from a central emphasis on profit maximization, we differ in how we believe this can be achieved. We critique the SET approach put forward from three key positions: (a) the SET approach and the application of virtue ethics; (b) the SET approach and the use of the marketing mix to operationalize it in practice; and, (c) the missing systemic and institutional barriers which we believe render SET problematic both theoretically and in practical terms. We conclude by suggesting that instead of utilising normative ethical theories to address socio-ecological challenges marketing researchers turn to other perspectives, such as ecofeminism."
‘Spatio-market practices’: conceptualising the always spatial dimensions of market making practices,"Holmes, Torik ;  Fernandes, Josi ;  Palo, Teea",Business and Management ;  Casino gambling ;  Conceptual ;  Market making ;  Marketing ;  Social Sciences ;  Spatial theory ;  Spatio-market practices ;  Theory ;  Theory/Conceptual,"AMS review, 2021, Vol.11 (3-4), p.316-335","Socio-material conceptualisations of markets suggest that they are spatial formations. Yet, the everyday practical and spatial dimensions of market making have received little explicit attention. We thus introduce the concept of spatio-market practices, drawing on key ideas in market studies and spatial theory. We argue that examining spatio-market practices (and thus the spatial dimensions of markets) promises to provide fresh insight regarding what it takes to realise markets, their uneven distribution, and what and whom markets are (and are not) designed to serve. To demonstrate what the concept calls for, supports and promises, we take Humphreys’ (
2010
) influential paper as a starting point and draw on other secondary sources in order to articulate an alternative and spatially-oriented account of the growth and legitimacy of the American casino gambling market. This paper, in turn, contributes a subtle and yet incisive shift in thinking, which supports a more explicit means of exploring markets as spatial formations."
The design and performation of markets: a discussion,"Callon, Michel ;  Roth, Alvin E.",Business and Management ;  Commentary ;  Marketing ;  Social Sciences,"AMS review, 2021, Vol.11 (3-4), p.219-239",
Assessing and enhancing the impact potential of marketing articles,"Jaakkola, Elina ;  Vargo, Stephen L.",Business and Management ;  Marketing ;  Social Sciences ;  Theory/Conceptual,"AMS review, 2021, Vol.11 (3-4), p.407-415","Although the impact of marketing is a recognized priority, current academic practices do not fully support this goal. A research manuscript’s likely influence is difficult to evaluate prior to publication, and audiences differ in their understandings of what “impact” means. This article develops a set of criteria for assessing and enhancing a publication’s impact potential. An article is argued to have greater influence if it changes many stakeholders’ understandings or behaviors on a relevant matter; and makes its message accessible by offering simple and clear findings and translating them into actionable implications. These drivers are operationalized as a checklist of criteria for authors, reviewers, and research supervisors who wish to evaluate and enhance a manuscript’s potential impact. This article invites scholars to further develop and promote these criteria and to participate in establishing impact evaluation as an institutionalized practice within marketing academia."
Re-institutionalizing marketing,"Key, Thomas Martin ;  Clark, Terry ;  Ferrell, O. C. ;  Stewart, David W. ;  Pitt, Leyland",Academic marketing ;  Business and Management ;  Commentary ;  Graduate studies ;  Marketing ;  Social Sciences,"AMS review, 2021, Vol.11 (3-4), p.446-453","Hunt’s (AMS Rev, 10, 189–198,
2020
) notion of the re-institutionalization of marketing as a discipline provides the background for this commentary. This forward-looking context is used to address issues the marketing discipline is facing to reconcile problems we identify. Academic marketing research has become fragmented and polarized into narrow areas that do not provide holistic contributions to knowledge. Doctoral programs are focusing less on core marketing knowledge and theory and more on methodology. This brings into question the culture of both our doctoral programs and the culture of the discipline to provide high-impact research valuable to practitioners and society, as well as the firm. An agenda for change addresses hiring practices, projects, methods, and oversight on the importance of impact. It is suggested the marketing discipline engage in the study of marketing practice to find important problems to investigate."
Market-shaping phases—a qualitative meta-analysis and conceptual framework,"Flaig, Alexander ;  Kindström, Daniel ;  Ottosson, Mikael",Business Administration ;  Business and Management ;  Economics and Business ;  Ekonomi och näringsliv ;  Företagsekonomi ;  market creation ;  market strategy ;  market-shaping ;  Marketing ;  markets ;  Samhällsvetenskap ;  Social Sciences ;  Theory/Conceptual,"AMS review, 2021, Vol.11 (3-4), p.354-374","This study explores the potential existence of reoccurring patterns in market-shaping processes by employing a qualitative meta-analysis to analyze 79 case studies on market-shaping. Through the evidence-based synthesis of qualitative data, we extract 20 generalized market-shaping activities that inform and form the foundation of a three-phased market-shaping process. This conceptual framework divides the market-shaping process into the phases of infusion, formation and retention. By applying our conceptual framework to the qualitative dataset, we explore the presence of market-shaping phases and provide further insights into the interdependences and dynamics between multiple, simultaneously occurring, market-shaping processes. By providing a structured market-shaping process, we attempt to reduce the overall complexity of the market-shaping phenomenon and facilitate the operationalization of the phenomenon for further market-shaping research. Additionally, our conceptualization provides practitioners with a framework to analyze the market-shaping efforts of other market actors and support the design of their own market-shaping strategies."
Advancing marketing theory and practice: guidelines for crafting research propositions,"Ulaga, Wolfgang ;  Kleinaltenkamp, Michael ;  Kashyap, Vishal ;  Eggert, Andreas",Business and Management ;  Marketing ;  Social Sciences ;  Theory/Conceptual,"AMS review, 2021, Vol.11 (3-4), p.395-406","Effective research propositions are key to advancing marketing theory and practice. However, our discipline provides little guidance on how to systematically craft impactful propositions. Consequently, scholars often refrain from including propositions in conceptual articles due to either a lack of knowledge or the confidence to do so. This proves detrimental to scholars looking to develop theory and conceptual papers. To address this challenge, our article defines research propositions and positions them within the broader set of the key building blocks of theory development. Based on an integrative framework that ties foundational premises, concepts, constructs, research propositions and hypothesis together, the article lays out four easy-to-follow actionable steps—grounding, crafting, connecting, and simplifying—that guide scholars in developing effective research propositions. Further, the article proposes four criteria, i.e., clarity, consistency, conciseness, and contribution to theory advancement and scholarly research, to assist scholars in evaluating outcomes achieved when writing research propositions. The article concludes by offering an agenda for how key stakeholders involved, i.e., Ph.D. students, early career researchers and established marketing scholars, university research program directors and promotion and tenure (P&T) committees, as well as reviewers and journal editors, can contribute to advancing knowledge and skills of crafting effective research propositions as part of the broader goal to stimulate the innovation and growth of marketing theories in our discipline."
Netflix: Reinvention across multiple time periods,"Jaworski, Bernard J.",Business and Management ;  Marketing ;  Social Sciences ;  Theory/Conceptual,"AMS review, 2021, Vol.11 (1-2), p.180-193",
"The methodologies of the marketing literature: mechanics, uses and craft","Clark, Terry ;  Key, Thomas Martin",Business and Management ;  Marketing ;  Social Sciences ;  Theory/Conceptual,"AMS review, 2021, Vol.11 (3-4), p.416-431","Of the three scholastic modes with which to develop ideas and create knowledge in research: logic, empirics, and the
literature
, the latter is perhaps one of the least understood and studied. This paper is a first-of-its-kind delve into what the literature is, how it is used, and its impact as a foundation for theory and conceptual work in the discipline of marketing. We create a novel approach that provides a framework to understand the way literature functions in the research process and expose the hidden mechanics of how it creates and ties together various forms of meaning through what we call, citation-based reasoning. It is through this lens that we conclude with insights for how a deeper understanding of the literature can stoke continued impact in the marketing discipline, especially for theory building and conceptual development."
A bridge to relevance: on the history of the Academy of Marketing Science® (AMS),"Babin, Barry J. ;  Moulard, Julie Guidry ;  Lindquist, Jay D.",Business and Management ;  Commentary ;  Marketing ;  Social Sciences,"AMS review, 2021, Vol.11 (3-4), p.454-463","AMS has survived half a century. Originally envisioned by Harold W. Berkman, who survived nearly a full century, the association has grown in numbers and in prominence. While AMS is well-known for its two leading academic journals and for hosting well-attended annual conferences and the World Marketing Congress, relatively little has been written about AMS history. We contribute a brief history of AMS that emphasizes the organization’s missions and values. In particular, AMS, along with its publications and conferences, has been, is, and will continue to aim to represent, a bridge between the academic and practicing marketing community. Further, that bridge should be built upon quality, service, and integrity."
Managing creatively-inspired brands: a commentary and research direction,"Dion, Delphine",Business and Management ;  Commentary ;  Marketing ;  Social Sciences,"AMS review, 2021, Vol.11 (3-4), p.471-473","In their conversation, Professor Gregory Carpenter, the Harold T. Martin Professor of Marketing at Northwestern, and Xavier Barlier, head of marketing in the US for Champagne Louis Roederer, discuss challenges managers face in keeping luxury brands relevant. The topics raised throughout the interview give rise to numerous interesting research questions on creatively inspired-brands."
Informing marketing theory through consumer culture theoretics,"Arnould, Eric ;  Crockett, David ;  Eckhardt, Giana",Business and Management ;  Editorial ;  Marketing ;  Social Sciences,"AMS review, 2021, Vol.11 (1-2), p.1-8",
The textuality of markets,"Humphreys, Ashlee",Business and Management ;  Marketing ;  Social Sciences ;  Textuality ;  Theory/Conceptual,"AMS review, 2021, Vol.11 (3-4), p.304-315","Although social embeddedness is an important and enduring aspect of markets, markets are also increasingly embedded in text—by which I mean alpha-numeric characters that stand in for phonetic spoken language. In this piece, I explore how text and textual thinking is an important precursor to certain forms of exchange behavior, mediates the market, and impedes or facilitates exchange. Looking at the affordances of text and textuality, I consider the ways that text orients the social practices critical to market exchange through its archival and public nature."
Market expertise at work: introducing Alvin E. Roth and Michel Callon,"Kjellberg, Hans",Business and Management ;  Commentary ;  Marketing ;  Social Sciences,"AMS review, 2021, Vol.11 (3-4), p.216-218",
Mapping spheres of exchange: a multidimensional approach to commoditization and singularization,"Brondino-Pompeo, Karin",Business and Management ;  Marketing ;  Social Sciences ;  Theory/Conceptual,"AMS review, 2021, Vol.11 (1-2), p.81-95","The process of commoditization–singularization, as developed by Kopytoff, is a compelling concept for understanding market exchange, and has been explored predominantly by scholars of consumer culture theoretics. The concept allows us to examine complex interactions between people, objects, and the dynamics of a market, and the literature based on it has illuminated the intricate tensions and contradictions within and between spheres of exchange. The use of the concept, however, is not without problems since some studies have applied dualistic or simplistic versions of it. This paper illustrates the current state of affairs by revisiting Kopytoff’s seminal work and analyzing the marketing and consumer research literature that derives from it, thus demonstrating how the conceptualization has evolved over time. In an attempt to overcome the dualist approach and further explore this topic, I propose a multidimensional perspective of spheres of exchange, offering an alternative approach for investigating the commoditization–singularization process."
Developing a strong sustainability research program in marketing,"Press, Melea",Business and Management ;  Conceptual ;  Consumer culture theory ;  Critical marketing ;  Increasing impact ;  Marketing ;  Marketing strategy ;  Paradigm shift ;  Research program ;  Social Sciences ;  Strong sustainability ;  Sustainability ;  Theory ;  Theory/Conceptual,"AMS review, 2021, Vol.11 (1-2), p.96-114","This article takes stock of sustainability research in marketing and argues for developing a Strong Sustainability Research (SSR) program, led by a Consumer Culture Theory (CCT) approach. First, I define weak vs. strong sustainability and identify two main problems with continuing to research business with the weak sustainability approach. Second, I discuss past approaches to sustainability research in marketing, which primarily promote weak sustainability. Third, I use the agriculture industry to illustrate how an SSR program in marketing could be developed to bring insights to practitioners and policy makers and build new modes of production, consumption and exchange. Finally, I suggest that the SSR program facilitates collaboration between mainstream marketing and CCT researchers by providing a common ontological platform that can transform epistemological differences into complementary strengths. I argue SSR is a way that marketing research can gain broad impact and relevance."
